{
  "$schema": "http://json-schema.org/draft-07/schema#",
  "title": "Escoje tu Historia - Telemetry Payload",
  "type": "object",
  "additionalProperties": false,
  "anyOf": [
    {
      "properties": {
        "session_id": { "type": "string", "format": "uuid" }
      },
      "required": ["session_id"]
    },
    {
      "properties": {
        "pseudonym": { "type": "string", "maxLength": 64 }
      },
      "required": ["pseudonym"]
    },
    {
      "properties": {
        "decisions": {
          "type": "array",
          "minItems": 1,
          "items": {
            "type": "object",
            "additionalProperties": true,
            "properties": {
              "decision_id": { "type": "string", "format": "uuid" },
              "timestamp": { "type": "string", "format": "date-time" },
              "chapter_id": { "type": "string" },
              "scene_id": { "type": "string" },
              "option_id": { "type": "string" },
              "option_text": { "type": "string" },
              "time_to_decision_ms": { "type": "integer", "minimum": 0 },
              "mapping_confidence": { "type": "number", "minimum": 0, "maximum": 1 },
              "validation_steps": { "type": "array", "items": { "type": "string" } },
              "risk_flags": { "type": "array", "items": { "type": "string" } },
              "raw_mapping": { "type": "object" },
              "parsed_mapping": { "type": "object" },
              "designer_mapping": { "type": "array", "items": { "type": "object" } }
            },
            "required": ["timestamp", "scene_id", "option_id"]
          }
        }
      },
      "required": ["decisions"]
    }
  ],
  "properties": {
    "schema_version": { "type": "string", "description": "Schema version" },
    "generated_at": { "type": "string", "format": "date-time" },
    "session_id": { "type": "string", "format": "uuid" },
    "pseudonym": { "type": "string", "maxLength": 64 },
    "user_token": { "type": "string" },
    "consent_given": { "type": "boolean" },
    "privacy_mode": { "type": "string", "enum": ["anonymous", "tracking"] },
    "started_at": { "type": "string", "format": "date-time" },
    "ended_at": { "type": ["string", "null"], "format": "date-time" },
    "session_length_seconds": { "type": ["integer", "null"], "minimum": 0 },
    "abandonment_flag": { "type": "boolean" },
    "device_id": { "type": "string" },
    "device_type": { "type": "string" },
    "ingest_batch_id": { "type": ["string", "null"], "format": "uuid" },
    "source": { "type": "string" },
    "chapter_id": { "type": "string" },
    "metadata": { "type": "object" },
    "llm_request": { "type": "object" },
    "llm_response": { "type": "object" },
    "context": { "type": "object" },

    "decisions": {
      "type": "array",
      "minItems": 1,
      "items": {
        "type": "object",
        "additionalProperties": true,
        "properties": {
          "decision_id": { "type": "string", "format": "uuid" },
          "timestamp": { "type": "string", "format": "date-time" },
          "chapter_id": { "type": "string" },
          "scene_id": { "type": "string" },
          "option_id": { "type": "string" },
          "option_text": { "type": "string" },
          "time_to_decision_ms": { "type": "integer", "minimum": 0 },
          "mapping_confidence": { "type": "number", "minimum": 0, "maximum": 1 },
          "validation_steps": { "type": "array", "items": { "type": "string" } },
          "risk_flags": { "type": "array", "items": { "type": "string" } },
          "raw_mapping": { "type": "object" },
          "parsed_mapping": { "type": "object" },
          "designer_mapping": { "type": "array", "items": { "type": "object" } }
        },
        "required": ["timestamp", "scene_id", "option_id"]
      }
    },

    "session_summary": {
      "type": "object",
      "properties": {
        "total_decisions": { "type": "integer" },
        "avg_decision_time_ms": { "type": "number" },
        "emotional_score_gds": { "type": "number" },
        "emotional_score_phq": { "type": "number" },
        "risk_flags_detected": { "type": "integer" },
        "abandonment_reason": { "type": ["string", "null"] }
      }
    },

    "audio_metrics": {
      "type": "array",
      "items": {
        "type": "object",
        "properties": {
          "audio_id": { "type": "string", "format": "uuid" },
          "timestamp": { "type": "string", "format": "date-time" },
          "valence": { "type": "number" },
          "arousal": { "type": "number" },
          "sadness_score": { "type": "number" },
          "speech_rate": { "type": "string" }
        }
      }
    },

    "technical_metadata": {
      "type": "object",
      "properties": {
        "skill_version": { "type": "string" },
        "llm_model": { "type": "string" },
        "alexa_device_id": { "type": "string" },
        "network_latency_ms": { "type": "integer", "minimum": 0 }
      }
    }
  }
}
